imported_result,preferred_source_family,local_use
Extensional uniqueness of admissible interior,Non-Degenerate Construction and the Kernel of Admissibility; The Structure of Admissibility,Blocks primitive NonSphere branch as plural admissible interior.
Standing equals reuse-stable admissibility,Kernel of Admissibility; Standing-Admissibility Identity Closure,Endpoint values must have standing and cannot remain mere labels.
No second same-domain classifier,"Standing-Admissibility Identity Closure; Anchor, Tensor, and Skin",Closes L11a rival endpoint classifiers.
No generators/no carriers/no repair,Bivalence; Kernel; Impossibility Suite,Classifier cannot generate standing for its own negative value.
UEAP report preservation,Claim Standing and Legitimacy,Negative endpoint reports require carrier-adequate support.
AMetric no-selector,The AMetric Boundary,No representation/triangulation/metric selector decides endpoint.
ATS skin non-authority,"Anchor, Tensor, and Skin",Endpoint labels are not proof-bearing without tensor support.
Hidden invariant exhaustion,Same-domain discriminator exhaustion rows,Unknown invariants must enter coordinate basis or do no endpoint work.
